"Plasticizers in microplastics, a critical view","Plastic represents an important material used in a broad range of applications. Increasing demand for plastic is a direct result of its ability to support the production of high performance products that meet or exceed consumer expectations. Increasing demand for plastic, however, has also been shown to be correlated with an increase in the generation of plastic waste. Concerns regarding plastic pollution, as well as the presence of nano- and microplastic particles (NMPs) in environmental systems, could thus be perceived as an unintended consequence of a material that has been too successful at supporting innovation in a variety of commercial applications. Over the last several years there has been significant investment in scientific research aimed at assessing the implications that exposure to NMPs in the environment represent to both human health and environmental systems. Various concerns have been communicated in the scientific literature, including studies that report relatively large numbers of NMPs in various foods and beverages, as well as in human biological tissues. These same studies, however, have also been challenged with respect to the reliability and relevance of the d",CONF_3179,Todd Gouin,TG Environmental Research,2026.0,CONFERENCE,0,0,0,0,,,,0,1,,0,0,0,0,0,0,0,0,0,0,0,0,0,0,0,0,0,0,0,0,0,0,0,0,1,0,0,0,0,,0,0,0,1,0,1,0,0,1,0,0,0,0,0,0,0,0,0,0,0,0,0,0,0,0
ATSDR Resources for Interactive Visualizations of Micro- and Nanoplastics and Human Health Research Data,"Micro- and nanoplastic research is rapidly expanding, producing a volume of literature that makes it difficult to synthesize findings and identify gaps. To address this challenge, the Agency for Toxic Substances and Disease Registry (ATSDR) Microplastic and Human Health workgroup has developed multiple data visualization tools to provide streamlined access to rigorously evaluated data. Hubs for Interactive Literature (HILs) compile literature used to produce the corresponding workgroup review articles. HILs filter and offer easy access to the original references. These visualizations allow rapid review of microplastics research data and isolate specific subtopics of interest to generate new ideas and quickly identify data gaps. HILs incorporate a novel world map to explore global microplastics data and related public health issues and enable targeted exploration of specific themes within the literature. Currently, there are four HILs that, collectively, have been viewed over 1,300 times. The Plastics Related Toxicological Profile Tool organizes health endpoint data extracted from 98 ATSDR toxicological profiles representing over 400 chemicals related to plastics production. It integrates AT",CONF_3180,Custodio Muianga,CDC-ATSDR,2026.0,CONFERENCE,0,0,0,0,,,,0,1,,0,0,0,0,0,0,0,0,0,0,0,0,0,0,0,0,0,0,0,0,0,0,1,0,1,0,0,0,0,,0,0,0,1,0,1,1,0,0,0,0,0,0,0,0,0,0,0,0,0,0,0,0,0,0
Unexpectedly High Accumulation of Nanoplastics in the Human Placenta,"Nanoplastics (NPs), plastic particles smaller than 1 µm, have become a major environmental and public health concern. They can enter the human body through food, air, and water, yet direct evidence of their biodistribution, particularly across maternal and fetal organs, remains scarce. This study investigated the distribution of fluorescently labeled polystyrene nanoplastics (100 nm) in pregnant rats, focusing on their presence in the placenta, fetal liver, and brain. Pregnant rats on gestational day 15 received intravenous injections of fluorescent nanoparticles. After 48 hours, placental and fetal tissues were collected, fixed, and analyzed by confocal fluorescence microscopy under standardized conditions. Quantitative image analysis revealed strong NP fluorescence in the placenta and lower 19 but detectable signals in the fetal liver and brain. The fluorescence intensity in the placenta was about 2.5 times higher than in the liver and 3.1 times higher than in the brain, indicating that the placenta serves not only as a semipermeable barrier but also as a major accumulation site. accurate identification and quantification at the single-particle level particularly challenging. Here, w",CONF_3181,Yasue Mitsukura,Keio University,2026.0,CONFERENCE,0,0,0,0,,,,0,1,,0,0,0,0,0,0,0,0,0,0,1,1,0,0,0,1,1,0,0,0,0,1,0,0,0,0,1,0,0,,1,0,0,0,0,0,1,0,0,0,0,0,0,0,0,1,0,1,0,1,0,0,1,0,0
Rapid Single-Particle Chemical Imaging and Analysis of Nanoplastics by Stimulated Raman Scattering Microscopy,"Here, we present a stimulated Raman scattering (SRS) microscopy platform that achieves rapid, chemically specific imaging of individual nanoplastics down to 100 nm. By combining a comprehensive spectral library with data-driven polymer identification algorithms, our method recovers chemical specificity beyond conventional spectral-matching approaches. We apply this workflow to bottled water, quantifying thousands of individual micro- and nanoplastics with multidimensional statistical profiling, including number- and mass-based abundance, polymer-specific size distribution, and particle morphology. This single-particle approach reveals tremendous heterogeneity in nanoplastic populations and uncovers previously inaccessible exposure information. Beyond environmental monitoring, our framework provides a broadly applicable strategy for imaging nanoplastics in biological matrices, laying the foundation for mechanistic studies of biodistribution and toxicity 27. Label-Free In Vivo Imaging of Nanoplastics Biodistribution by Stimulated Raman Scattering Microscopy Naixin Qian, Xin Gao, Mian Wei, Wei Min Columbia University The biological fate of nanoplastics remains poorly understood due",CONF_3182,Naixin Qian,Columbia University,2026.0,CONFERENCE,0,0,0,0,,,,0,1,,0,0,0,0,0,0,0,0,0,0,0,0,0,0,0,0,0,0,0,0,0,0,1,0,1,0,1,0,0,,1,0,0,0,0,0,1,0,0,0,0,0,0,0,0,0,0,1,0,0,0,0,0,0,0
Advancing Microplastic Risk Assessment: The ToMEx 2.0 Database,"The Toxicity of Microplastics Explorer (ToMEx) is a hazard database and toolkit designed to enable quantitative risk assessment, quality evaluation, and more. Through a collaborative effort of > 75 volunteers from 14 countries, ToMEx just underwent a massive update - aggregating ~13,000 toxicity records from ~ 300 studies across freshwater and marine taxa. While this expansive dataset enables finer ecotoxicological hazard assessment – including the separation of freshwater and marine environments – unfortunately, 88% of studies still failed minimum quality criteria, emphasizing the urgent need for standardized, fit-for-purpose ecotoxicity testing. Assessing risks to ecosystems from microplastics requires modelling that accounts for the diverse, continuous nature of the unique contaminant suite. California previously developed and applied a quantitative risk assessment framework to handle the diverse nature of microplastics using ecologically relevant metrics, data alignments, and bioaccessibility modelling in combination with species sensitivity distributions (SSDs). However, uncertainties due to the modelling process were not fully accounted for. We expanded upon our previous methodo",CONF_3183,Scott Coffin,California OEHHA,2026.0,CONFERENCE,0,0,0,0,,,,0,1,,0,0,0,0,0,0,0,0,0,0,0,0,0,0,0,0,0,0,0,0,0,0,1,0,1,0,1,0,0,,0,1,0,0,0,1,0,0,0,0,0,0,0,0,0,0,0,1,0,0,0,0,0,0,0
Pyrolysis-GCMS analysis of Microplastics in the air atmosphere,"Microplastics are now a global problem. They are tiny fragments shed during the degradation of larger pieces of plastic. They are light enough to be transported by the wind over large distances. Due to their small size, Microplastics (MPs) end up in all sorts of places, including the air we breathe and the water we drink. In this presentation, we demonstrate the study of microplastics (MPs) in the air atmosphere. The method requires very little sample preparation. The MPs were collected by passive sampling method in three different rooms. After 30 days, the analysis was carried out using the micro-furnace pyrolyzer to perform Flash Pyrolysis-Gas chromatography/ Mass spectrometry (Py-GC/MS). Micro-furnace Py-GC/MS is an easy solid sample introduction technique that expands the application areas of GC/MS. It is easy to use and simple to operate. The solid samples can be analyzed as is without going through any solvent extraction steps. This fastens the workflow and reduces labor intensive. The data obtained were analyzed by using the F-search MPs library. The software created the calibration curve automatically, and quantification was done within minutes. Challenges and Opportunities i",CONF_3184,Athena Nguyen,Frontier Lab America,2026.0,CONFERENCE,0,0,0,0,,,,0,1,,0,0,0,0,0,0,0,0,0,0,0,0,0,0,0,0,0,0,0,0,0,0,0,0,0,0,1,0,0,,0,0,0,0,0,1,0,0,0,0,0,0,0,0,0,0,0,0,0,0,0,0,0,0,0
Challenges and Opportunities in the Toxicology of Microplastics in Ambient Air,"Human health effects of microplastics/nanoplastics (MP/NP) remain unclear due to a lack of systematic studies. Reference MP/NP reflective of real-world exposures are not available for toxicological testing, and formation of micronuclei, a marker of genetic damage. The smaller size fractions of MP/NP types were more genotoxic compared to their larger counterparts. Weathering impacted MP characteristics of some and influenced their toxicity. Gene expression analysis revealed pathways associated with pathogen response in MP-induced toxicity. composition. Toxicity was evaluated using lung cells. Endpoints assessed included cell viability, immune and inflammatory responses, gene expression changes, genotoxicity, and particle uptake. The gene expression profile induced by the most toxic MP/NP was compared to previously generated gene expression data from nanomaterial exposure in these cells. In the absence of information on effects of real-world MP/NP exposures, the methods developed and insights gained in this study are valuable. Preliminary results indicate that exposure to MP/NPs can be harmful to cultured cells. Although some apical responses are similar to those observed in cells",CONF_3185,Sabina Halappanavar,Health Canada,2026.0,CONFERENCE,0,0,0,0,,,,0,1,,0,0,0,0,0,0,1,0,0,0,0,0,0,1,0,0,0,0,0,0,0,1,1,1,1,0,1,0,0,,1,1,0,1,0,1,1,0,0,0,0,0,0,0,0,1,1,0,0,0,0,1,0,1,1
Environmental microplastics - from our households to our rivers and oceans and back to our table,"Sources of environmental microplastics into urban environments include washing machines, and dryer vents. However, the extent to which these various sources contribute microplastics into our air and water have not been explicitly compared. To assess whether washing machines or dryer vents are greater contributors of environmental microplastics, we simultaneously installed and sampled filters on household washing machines and dryers across two coastal communities for a 30 day period. We quantified the dry weight of the microparticles in each of the filter types and compared within and between households. We also surveyed users about the ease of use of each filter type. Washing machine and dryer type and age affected the amount of microparticles collected in the filters. The efficacy of the washing machine and dryer vent filters at trapping microplastics and the user experience can inform policy for wider application to minimize environmental microplastics from laundry. Reductions in microfibers entering the environment is essential to reducing exposure by organisms, including humans. 24 VOL 1 research seminars Januar y 12, 2026 Maternal-Fetal and Reproductive Health Polystyrene and po",CONF_3186,Elise Granek,Portland State University,2026.0,CONFERENCE,0,0,0,0,,,,0,1,,0,0,0,0,0,0,0,0,0,0,0,0,0,0,0,1,0,0,0,0,0,0,0,0,1,0,1,0,0,,0,0,0,0,1,1,0,1,0,0,0,0,0,0,0,0,0,1,0,1,0,0,0,0,0
Polystyrene and polyethylene terephthalate nanoplastics differentially impact mouse ovarian follicle function,"Exposure to micro- and nanoplastics is unavoidable. Foods and beverages contain plastic particles from environmental contamination and processing and packaging materials, which are frequently made of polyethylene terephthalate (PET). Micro- and nanoplastics have been detected in human tissues such as the brain, liver, and placenta, as well as in ovarian follicular fluid, but little is known about the effects nanoplastics have on the female reproductive system. In addition, few studies on the health impacts of nanoplastics have been performed using environmentally relevant plastic types and concentrations. Thus, this research tested the hypothesis that nanoplastics made of spherical polystyrene (PS), a common model nanoplastic, would have different effects on cultured mouse ovarian follicles compared to secondary PET nanoplastics at environmentally relevant doses. The ovary is a highly sensitive reproductive organ responsible for the development of follicles, which contain the oocyte, and production of steroid hormones. Follicles were harvested from adult mouse ovaries and cultured for 96 h with vehicle, spherical commercially available 220 nm PS nanoplastics (1–100 µg/mL), or lab-gener",CONF_3187,Genoa Warner,New Jersey Institute of Technology,2026.0,CONFERENCE,0,0,0,0,,,,0,1,,0,0,0,0,0,0,0,0,0,0,0,1,0,0,0,1,1,0,0,0,1,0,1,0,1,0,1,0,0,,0,0,0,1,0,0,1,0,1,0,1,0,0,1,0,0,0,0,0,1,0,0,1,0,0
"Polymer, Size, and Time Shape Microplastic Cytotoxicity Across Placental and Immune Cells","CC50 values were measured across three polymers (PE, PS, PVC), two sizes (Small, Large), and four timepoints (3, 6, 24, 48 h) in human trophoblasts (BeWo, HTR8, JEG3), T cells (Jurkat), and macrophages (THP-1). Replicate-level dose-response data were modeled using a mixed-effects framework: cc50 ~ cell_line Size + cell_line Timepoint + cell_line*Treatment + (1|Replicate). 25 Contrasts referencing Jurkat were obtained using emmeans. To control for multiple testing while maintaining power, we applied weighted Benjamini–Hochberg FDR (weights � 1/SE², mean-normalized) within biologically relevant families (e.g., Timepoint × Treatment × Size). Sensitivity analyses included hierarchical FDR and cell-type–specific family groupings. Inference was based on q-values. Results. Jurkat cells showed the highest resistance (reference CC50) and were used to assess differential susceptibility. After weighted FDR correction, responses varied by condition and did not follow global trends across polymers or cell types. A notable susceptibility window appeared in trophoblasts at 24 h with PS–Small: BeWo (∆ CC50 = −84; 95% CI −126, −42; q=0.042) and JEG3 (∆ = −99; 95% CI −141, −56; q=0.042) were signific",CONF_3188,Myla Stanford,Baylor University,2026.0,CONFERENCE,0,0,0,0,,,,0,1,,0,0,0,0,0,0,0,0,0,0,0,0,0,0,0,1,0,0,1,0,0,0,1,0,0,1,1,0,0,,0,1,0,0,0,1,0,0,0,0,0,0,0,0,0,0,1,1,0,1,0,0,0,1,0
Rethinking Fetal Risk: What 14C-Polystyrene Reveals About Nanoplastic Accumulation During Pregnancy,"Micro- and nanoplastic exposure is now a certainty; what remains uncertain is how particles distribute and translocate during pregnancy. We propose a quantitative, artifact-resistant framework for tracking nanoplastic accumulation using carbon-14-labeled polymers. 14C-radiolabeling has become a valuable technique for understanding the in vivo behavior of various compounds while preserving their original composition and 26 Enrico Barrozo, PhD Baylor College of Medicine Authors: Megan V. Alexander, MD1,2,*; Irene Peregrin-Álvarez, MD1,2,*; Audrey Messelt, MD1,2; Momal Sharif, PhD1,2sHailie N. Ciomperlik, MD1; Ninad M. Patil, MD1,3,4; Marcus A. Garcia, PharmD5; Laurissa Barela, BS5; Matthew J. Campen, PhD5; Enrico R. Barrozo, PhD1,†; Laura Detti, MD1,2 [*co-first; †corresponding; Presenting Author] Affiliations: 1. Baylor College of Medicine & Texas Children’s Hospital, Department of Obstetrics & Gynecology, 1 Baylor Plaza, Houston, TX 77030 2. Division of Reproductive Endocrinology and Infertility permutation-FDR control, FF PET and N6 are linked to reduced fertilization rates (with N6 also associated with lower blastulation), and endometrial PVC is connected to path-confirmed poly",CONF_3189,Olga Khaybullina,University of Alabama-Birmingham,2026.0,CONFERENCE,0,0,0,0,,,,0,1,,0,0,0,0,0,0,0,0,0,0,0,0,0,0,0,1,0,0,0,0,0,0,0,0,1,0,0,0,0,,0,0,0,0,0,0,1,0,0,0,0,0,0,0,0,1,0,0,0,1,0,0,0,0,0
Micro- and Nanoplastics in the Human Reproductive Tract: Blank-Corrected Polymer Burdens in Follicular Fluid and Endometrium,"Objective: To quantify micro- and nanoplastic (MNP) polymers in follicular fluid (FF, µg/mL) and endometrium (µg/g tissue) using blank-corrected pyrolysis-GC/MS, and to examine associations with IVF outcomes and endometrial pathology. Design: Cross-sectional analyses of prospectively collected FF and clinically indicated endometrial specimens from a single academic center. Materials and Methods: Twelve polymers were quantified using Py-GC/MS. QC/contamination control included specimen collection procedural blanks, 0.2-µm filtered solvents, polymer-specific calibration curves, and a positive-pressure hood. Blank subtraction was performed for each batch on a polymer basis; negative values were set to zero and flagged. LOD/LOQ were estimated from blank distributions (LOD≈mean_blank+3SD; LOQ≈ mean_blank+10SD). Exposures were log10(x+1)-transformed and scaled by IQR. Outcomes included fertilization and blastulation rates (%) and pathologist-confirmed endometrial polyps (yes/no). Models involved beta regression (logit link) for rates and logistic regression (Firth when needed) for binary variables, adjusted for maternal age and BMI at retrieval (centered), as well as male-factor infertility; r",CONF_3190,Enrico Barrozo,Baylor College of Medicine,2026.0,CONFERENCE,0,0,0,0,,,,0,1,,0,0,0,0,0,0,0,0,0,0,0,0,0,0,0,1,0,0,0,0,0,0,0,0,1,0,1,0,0,,0,0,0,0,0,1,1,0,0,0,0,0,0,1,0,0,0,1,0,1,0,0,0,0,0
Micro and nanoplastic inhalation throughout pregnancy disrupts placental invasion and morphology in Sprague-Dawley rats,"Micro- and nanoplastic particles (MNP) are a ubiquitous environmental contaminants. Multiple studies have shown that MNP translocate to and deposit within human placental tissues. Central to placental function is appropriate uterine invasion and the adequate development of maternal-fetal blood spaces for nutrient and waste exchange. Impaired to placental invasion and morphological development have been associated with decreased maternal health and poor fetal outcomes. To date, placental development has not been assessed following maternal exposure to MNP throughout pregnancy. Pregnant Sprague-Dawley rats were exposed to polyamide-12 (nylon) MNP from gestational day (GD) 5 through GD 19. Gross and histological analysis of",CONF_3191,Phoebe Stapleton,Rutgers University,2026.0,CONFERENCE,0,0,0,0,,,,0,1,,0,0,0,0,0,0,0,0,0,0,0,0,0,1,0,1,0,0,0,0,0,0,0,0,1,0,1,0,0,,0,0,0,0,0,1,1,0,0,0,0,0,0,0,0,0,0,1,0,1,1,1,0,0,0
p-CAPture: A novel method to identify and quantify micro- and nanoplastics,"The ubiquitous existence of micro- and nano-plastics (MNPs) raises concerns associated with their potential impact on human and planetary health. However, while mapping MNPs has been conducted in various environmental settings, including marine, freshwater, terrestrial, and atmospheric systems, and, more recently, in human tissues, the low throughput, a lack of standardized protocols and sparse sampling density hinder the development of comparable maps. As a result, while environmental and human microplastic mapping has begun, scalable, sensitive, and cross-validated techniques are still needed to accurately assess distribution, exposure, and risk. For instance, FTIR and Raman spectroscopy allow for non-destructive chemical identification but can only analyze particles larger than 10 µm. Py-GC/MS, while capable of detecting a broad range of polymer types and particle sizes (from nanometers to micrometers), relies on mass-based detection rather than size resolution. The need for large sample together with the slow/laborious processing time (a few hours to days) poses barriers to widespread monitoring and exposure assessment. Our current technology processes 50–200 µL per sample in 4",CONF_3192,Alba Torrents de la Peña,Scripps Research,2026.0,CONFERENCE,0,0,0,0,,,,0,1,,0,0,0,0,0,0,0,0,0,0,1,0,0,0,0,0,0,0,0,0,0,0,0,0,1,0,1,0,0,,1,0,0,0,0,1,1,0,0,0,0,0,0,1,0,0,0,1,0,0,0,0,0,0,0
Advancing the method for isolating and quantifying MNPs in human cerebrospinal fluid for Brain Waste Clearance Studies,"MNPs have been detected in human feces, urine, blood, and various organs, raising concerns about human exposure and potential health implications. However, isolating and quantifying MNPs from complex biological matrices remains a major analytical challenge. Our team has made significant development by developing a novel approach to isolate and quantify MNPs from human tissues using advanced spectroscopic and microscopic techniques. The findings show significant MNPs accumulation in the human brain compared to the liver and kidney, raising concerns about brain waste management and potential toxic effects on the central nervous system (CNS) function. Here, we assess the quantity and physicochemical properties of MNPs in human cerebrospinal fluid (CSF) using pyrolysis-gas chromatography-mass spectrometry (Py-GC-MS). The initial quantitative measurement was conducted on CSF samples (n=14) collected from a brain injury cohort. Polymer concentrations ranging between 13.3 and 82.8 µg/ml were detected, with a mean of 22 µg/ml for the summed polymer concentrations. To validate our experimental approach, artificial cerebrospinal fluid (aCSF) spiked with known polymer standards is analyzed to assess",CONF_3193,Sakshi Patil,University of New Mexico,2026.0,CONFERENCE,0,0,0,0,,,,0,1,,0,0,0,0,0,0,0,0,0,0,0,1,1,0,0,0,1,1,0,0,0,0,1,0,1,0,1,0,0,,1,0,0,0,0,1,1,0,0,0,0,0,0,1,0,1,0,1,0,0,1,0,1,0,0
Trace Level Quantitation of Micro- and Nanoplastics Utilizing Thermal Desorption and Pyrolysis-GC/MS Coupled with Selective Ion Monitoring,"Micro- and nanoplastics (MNPs) are now ubiquitous across atmospheric, aquatic, terrestrial, and biological systems, creating urgent challenges for environmental monitoring and risk assessment. Conventional techniques such as ATR-FTIR and SEM are constrained by particle size limits and surface dependence, while existing pyrolysis–gas chromatography mass spectrometry (py–GC/MS) workflows suffer from matrix-driven interferences, 30 Yingyue Ni (Department of Environmental Health, Boston University School of Public Health, Boston, Massachusetts; presenting author); Kuanliang Shao, Ronald Smith, Christian Freeman, Parth Jariwala, Douglas I. Walker (Gangarosa Department of Environmental Health, Rollins School of Public Health, Emory University, Atlanta, GA) Ubiquitous microplastic exposure raises concerns for human health. However, the exposure assessment of microplastics continues to be a formidable challenge, with over 2,400 substances exhibiting potentially toxicity. Existing analytical methods remain limited in identifying signals from complex mixtures, with traditional approaches primarily focusing on quantitative analysis of target polymers and relying on manual compound annotati",CONF_3194,Justin Scott,Cove Environmental,2026.0,CONFERENCE,0,0,0,0,,,,0,1,,0,0,0,0,0,0,0,0,0,0,0,0,0,0,0,0,0,0,0,0,0,1,1,0,1,0,1,0,0,,1,0,0,1,0,1,1,0,0,0,0,0,0,0,0,0,0,1,0,0,0,0,0,0,0
A machine-learning powered pipeline for microplastic quantification and classification using Py-GC/HRMS,"Ubiquitous microplastic exposure raises concerns for human health. However, the exposure assessment of microplastics continues to be a formidable challenge, with over 2,400 substances exhibiting potentially toxicity. Existing analytical methods remain limited in identifying signals from complex mixtures, with traditional approaches primarily focusing on quantitative analysis of target polymers and relying on manual compound annotations. Our team established a pipeline to quantify and classify microplastic polymers based on Pyrolysis–GC/High-resolution MS (Py-GC/HRMS) total chromatogram full-scan mode data. Further, it validated the additivity of the full-spectrum signal matrix. We proposed and implemented a novel framework with the ability to deconvolute mixture microplastic signals, which was constructed through random linear addition of signal matrix from different polymers and concentrations in our experimental dataset. This method effectively identifies major components and their absolute concentrations. Capable of automated and reproducible processing of high-throughput data. With the establishment of a comprehensive polymer reference database, this framework demonstrates signi",CONF_3195,Yingyue Ni,Boston University,2026.0,CONFERENCE,0,0,0,0,,,,0,1,,0,0,0,0,0,0,0,0,0,0,0,0,0,0,0,0,0,0,0,0,0,1,1,0,1,0,1,0,0,,1,0,0,1,0,1,0,0,0,0,0,0,0,0,0,0,0,0,0,0,0,0,0,0,0
