"Chronic Dietary Microplastic Exposure Weakens Skeletal Integrity Aaron S. Romero, Sumira Phatak, Hamid Y. Dar, Sanchiti Patil, Brianna B. Maes, Jaclyn A. Rivas, Siem S. Goitom, Fredine T.","Humans are estimated to ingest up to 5 grams of microplastics (MPs) weekly through diet, yet the physiological consequences of chronic exposure remain poorly understood. Emerging evidence suggests MPs can disrupt endocrine function and accumulate in various systemic tissues, but the effects on the skeletal system remain unclear, particularly regarding the gut–bone axis. To investigate this, we exposed C57BL/6J mice to polystyrene MPs (0.5–5 µm) incorporated into standard diet pellets for 12 weeks. Although no significant differences were observed in body weight, fat mass, energy intake, or inflammatory markers (serum TNFα, fecal LCN-2 and sIgA) compared to controls, microCT analysis revealed sex121 and site-specific skeletal changes following chronic MP exposure. In females, MP exposure reduced spinal trabecular thickness without altering connectivity density and caused reductions in femoral cortical area, cortical thickness, trabecular bone volume fraction (BV/TV), along with increased trabecular separation. In males, spinal BV/TV was preserved, but trabecular thickness increased while connectivity density declined. Male femurs showed reduced BV/TV and increased trabecular separation. Interestingly, serum serotonin levels were elevated in exposed mice. In vitro, serotonin as well as MP exposure significantly reduced osteoblast mineralization, indicating a direct cellular mechanism underlying the in vivo bone loss. Lastly, MPs were detected in human femoral bone tissue supporting a role for hormonal and environmental factors in disrupted bone homeostasis. These findings suggest chronic MP exposure induces skeletal degradation in a sex- and sitedependent manner. The architectural pattern observed, particularly reduced connectivity with compensatory thickening in male spines, resembles osteoporotic bone. Our findings highlight dietary MPs as a novel risk factor for compromised skeletal integrity, with implications for long-term musculoskeletal health in exposed populations.",CONF_3310,Lauer,"Division of Gastroenterology and Hepatology, Department of Internal Medicine, University of New Mexico School of Medicine",2026.0,CONFERENCE,0,0,0,0,,,,0,1,,0,0,0,0,0,0,0,0,0,0,0,0,1,0,0,0,0,0,1,0,1,1,1,1,1,0,1,0,0,,0,0,1,0,0,1,0,0,0,1,1,0,0,0,0,0,1,0,1,0,0,0,0,1,0
Chylomicron-Mediated Translocation of Oxidized Nano- and Microplastics into the Circulatory System and Human,"Rising global concentrations of environmental microplastics and nanoplastics (MNPs) raise significant concerns regarding human exposure and long-term health outcomes. Previous studies from our group demonstrated widespread MNP deposition across multiple organs. In this study, we investigated intestinal absorption and systemic transport pathways that enable MNP entry into the circulatory system and subsequent accumulation of distinct MNPs in the human heart and cardiovascular system. MNPs primarily enter the human body through ingestion of contaminated food and water. We hypothesized that nanoplastics, which have comparable chemical structure to free fatty acids and bind to monoglycerides, will become packaged within the small intestine into chylomicron complexes by enterocytes. Using fluorescently labeled MNPs of varying sizes, we observed that gavaged 500 nm polystyrene particles could be found co-localized in the chylomicron fraction of serum but not in VLDL/IDL/LDL fractions 4h post exposure. Interestingly, 1 µm particles were not detected in any fraction of the serum. These findings suggest a size–dependent mechanism of MNP trafficking within chylomicrons. Further work in human cadaver samples has been initiated to confirm that MNPs enter lacteals, pass through mesenteric lymphatic vessels, and merging into the thoracic duct before finally draining into the left subclavian vein, the gateway to the circulatory system. We quantified the MNP burden and confirmed their presence within lipid-dependent cardiac tissue samples obtained from 24 different human hearts and 37 different human heart arteries using pyrolysis gas chromatography–mass spectrometry (Py-GC/MS). MNPs were further confirmed by complementary analytical techniques including Fourier-transform infrared (FTIR) spectroscopy, Raman spectroscopy, and transmission electron microscopy (TEM). Collectively, our data supports a novel mechanistic model in which oxidized nanoplastics exploit lipid absorption pathways to reach systemic circulation and partially accumulate in cardiac tissue. These findings underscore the need for further investigation into MNP–lipid interactions and their implications for cardiovascular health.",CONF_3311,icroplastics into the Circulatory System and Human,"Milad MazloumiBakhshayesh, Laurissa R Barela, Daniel F. Gallego, Erin Risotto-Urbanowicz, Pierce Massie, Brenna Baird, | Crystal Cevering, Margaret E Park, Sakshi Siddharth Patil, Jessica G Begay, Risa M Smith, Rama R. Gullapalli, Guy Herbert, | Eliane El Hayek, Ross Clark, Julie In, Barry Bleske, Tzung Hsiai, Marcus Garcia, Matthew Campen | University of New Mexico",2026.0,CONFERENCE,0,0,0,0,,,,0,1,,0,0,0,0,0,0,0,0,0,0,0,0,1,0,1,0,0,0,0,0,0,1,0,0,1,0,1,0,0,,1,0,1,1,0,1,1,0,0,0,0,0,0,0,0,1,0,1,1,0,1,0,0,0,0
Combined impacts of PFAS and Micro/Nanoplastics on early neural development and behavior in zebrafish,"Environmental exposure to persistent pollutants poses growing health concerns, particularly for chemicals that are ubiquitous and bioaccumulative, such as micro- and nanoplastics (MNPs) and per- and polyfluoroalkyl substances (PFAS). Both classes are prevalent in household products, with ingestion occurring primarily through our food and water sources. MNPs have been detected in multiple organs, including the brain and liver, with accumulation increasing over time and independent of age or sex when measured. Similarly, different types of PFAS exhibit tissue-specific accumulation patterns, with several studies linking prenatal exposure to developmental delays, neurotoxicity, and even childhood leukemia. Using zebrafish as a model system to study developmental impacts of exposure, we have identified that exposure to PFOA, a type of PFAS still ubiquitous in our environment, disrupts gene expression profiles of several neural tissues during embryonic development. Given that both MNPs and PFAS can independently affect neuronal systems, and that a recent study in Daphnia reported additive toxicity under combined exposure, we aim to investigate their joint effects on vertebrate development. Specifically, we will assess how PFOA and polyethylene particles (ranging from ~3 mm microspheres to ~40 µm particles, and known to accumulate in human brains) alter early developmental pathways. We have established a behavioral assay to quantify zebrafish larval movement and have observed increased anxiety-like behavior following PFOA exposure. Our ongoing work examines the individual and combined effects of PFOA and polyethylene on both gene expression and behavioral outcomes, assessing whether MNPs disrupt the same molecular pathways as PFAS and whether co-exposure amplifies PFAS-induced toxicity. This study aims to provide an integrated understanding of how these pervasive contaminants jointly influence neural development and behavior, offering critical insights into the mechanisms of environmental toxicity at the organismal level.",CONF_3312,Zainab Afzal,North Carolina Central University,2026.0,CONFERENCE,0,0,0,0,,,,0,1,,0,0,0,0,0,0,0,0,0,0,0,1,0,0,0,0,1,0,0,0,0,1,1,0,1,0,1,0,0,,0,0,1,0,0,1,1,0,1,0,0,1,0,0,0,1,0,1,0,1,0,0,1,0,0
Comparison of Digestion Protocols for Crop and Food Matrices Prior to Micro(nano)plastic (MNPs) Analysis and Quantification,"One of the significant roadblocks to accurate analysis lies in sample preparation: plant cell walls are difficult to break down using traditional MNPs digestion protocols, which employ lightly destructive chemical methods to preserve the structural integrity of MNPs. This study investigates the use of surfactants, specifically Cetrimonium bromide (CTAB), enzymatic digestion, and diluted nitric acid (HNO₃), as predigestion methods, aiming to enhance the breakdown of plant tissues while preserving MNP integrity. We found that nitric acid was sufficient to break down rice, but beans required the introduction of enzymes (amylase, protease, cellulase, and pectinase). Initial data reveal the occurrence of polyethylene, polystyrene, polyvinyl chloride, and Styrene-Butadiene Rubber in estimated total mass concentrations above 100 mg/kg per dry weight. By developing a more effective pre-treatment approach and quantifying MNPs in rice, beans, fruits, and vegetables, this research aims to offer a clearer picture of human exposure through diet.",CONF_3313,Margaret Park,"Kingston1, Marcus Garcia1, Jorge Gonzalez-Estrella4, Matthew Campen1, Eliane El Hayek1 | 1 University of New Mexico, College of Pharmacy | 2 Zuni High School",2026.0,CONFERENCE,0,0,0,0,,,,0,1,,0,0,0,0,0,0,0,0,0,0,0,0,1,0,0,0,0,0,1,0,0,0,1,0,1,1,1,0,0,,1,0,0,0,0,1,1,0,0,0,0,0,0,0,0,0,0,0,0,0,0,0,0,1,0
DIY Microplastic Detectives: Visualizing plastics with fluorescence,"The purpose of this project is to design low cost DIY methods for citizen science detection of microplastics in the environment. The research includes classification of the properties of different types of plastics and modeling the fluorescence of plastics using, Red Nile Dye, as well as a DIY light box that uses blue light and an orange filter.",CONF_3314,Bree Oatman,Oglala Lakota College,2026.0,CONFERENCE,0,0,0,0,,,,0,1,,0,0,0,0,0,0,0,0,0,0,0,0,0,0,0,0,0,0,0,0,0,0,0,0,0,0,1,0,0,,0,0,0,0,0,1,0,0,0,0,0,0,0,0,0,0,0,0,0,0,0,0,0,0,0
Defining Unequivocal: Increasing Confidence In The Analysis And Reporting Of Micro- And Nanoplastic Particles In Biological Matrices,"Wright3,4, Jun-Li Xu23 1 Minderoo Centre − Plastics and Human Health, The University of Queensland, Woolloongabba, 4102, Australia 2 Queensland Alliance for Environmental Health Sciences, The University of Queensland, Woolloongabba, 4102, Australia 3 Environmental Research Group, School of Public Health, Imperial College London, UK 4 Medical Research Council Centre for Environment and Health, School of Public Health, Imperial College London, UK 5 European Commission, Joint Research Centre, Via Enrico Fermi 2749, 21027 Ispra, Italy 6 SINTEF Ocean, Postboks 4762 Torgard, N-7465 Trondheim, Norway 7 In Vitro Toxicology Group, Institute of Life Sciences, Faculty of Medicine, Health and Life Sciences, Swansea University, Singleton Park Campus, SA2 8PP, Wales, UK 8 UK Centre for Ecology & Hydrology, Maclean Building, Benson Lane, Crowmarsh Gifford, Wallingford, OX10 8BB, UK 9 Department of Chemical Toxicology, Norwegian Institute of Public Health, PO box 222 Skøyen. 0213 Oslo, Norway 10 Minderoo Foundation, Perth, WA, Australia 11 School of Biological Sciences, University of Western Australia, Crawley, WA, Australia 12 Department of Climate and Environment, Norwegian Research Centre, Mekjarvik, 12 - 4072 Randaberg, Norway 13 Department of Neurology, The First Affiliated Hospital of Shantou University Medical College, Shantou, China 14 Norwegian Institute of Public Health, 0456 Oslo, Norway 15 NILU, FRAM Centre, 9696 Tromsø, Norway 16 Aquatic Ecology & Water Quality Management, Wageningen University, Netherlands 17 ARC Training Centre for Hyphenated Analytical Separation Technologies (HyTECH), Queensland Alliance for Environmental Health Sciences, The University of Queensland, Woolloongabba, 4102 Australia 18 Analytical Chemistry Group, Van’t Hoff Institute for Molecular Sciences, University of Amsterdam, Amsterdam, The Netherlands 19 Murdoch Children's Research Institute, Parkville, Victoria, Australia 20 Gangarosa Department of Environmental Health, Rollins School of Public Heath, Emory University, Atlanta GA USA 21 Department of Histology and Embryology, Shantou University Medical College, Shantou, China 22 Department of Neurology, The First Affiliated Hospital of Shantou University Medical College, Shantou, China 23 School of Biosystems and Food Engineering, University College Dublin, Belfield, Dublin, Ireland The accurate quantification and characterisation of particles within biological systems is critical to assess potential health risk. However, identification of nanoplastics (<1µm) and small microplastics (<10µm) remains an analytical challenge, exacerbated in complex matrices such as environmental and human samples. Concerns regarding the potential impact of plastics on human health has, however, led to increasing numbers of studies aiming to identify small micron and nanoplastics within human tissues. Mass based quantification methods such as pyrolysis gas chromatography mass spectrometry are being increasingly used in attempts to identify and quantify small plastic particles in biological samples. However, this indirect analysis method is susceptible to sample matrix interference (e.g., due to the presence of lipids in biological tissues), resulting in quantification being unreliable for certain plastics such as polyethylene and polyvinyl chloride. Furthermore, no morphological information is provided, which is important toxicologically relevant information needed to inform accurate risk assessments. Optical microscopy coupled to spectroscopic methods such as Raman or Fourier-transform infrared are widely used for microplastic identification, however for smaller nano-sized particles, the resolution is not sufficient to accurately identify individual plastic particles. Therefore, we propose a framework to increase confidence by using multiple orthogonal techniques to identify plastics in biospecimens. The techniques use fundamentally different approaches which measure the same physical properties of a suspected plastic particle. Three categories of techniques are proposed, based on the amount of information they provide about chemical identification, morphology, and other physicochemical properties. The application of multiple techniques is proposed to enable unequivocal identification within complex matrices. Examples of potential analytical techniques will be presented, with their benefits and drawbacks highlighted to exemplify how the framework can be used. The limitations of each technique will be identified, and the framework requires that such limitations are clearly communicated when research data are reported to ensure transparency. The framework also includes confidence levels for identification of plastic particles with suggested minimum data requirements listed. This framework is proposed as a starting point for future minimum standards regarding publishing human internal exposure data, which will be critical for human health research and future risk assessment.",CONF_3315,d Reporting Of Micro- And Nanoplastic Particles In,,2026.0,CONFERENCE,0,0,0,0,,,,0,1,,0,0,0,0,0,0,0,0,0,0,0,1,0,0,0,0,0,0,0,0,0,1,1,0,1,0,1,0,0,,0,0,0,1,0,1,1,0,0,1,0,1,0,1,0,0,0,1,0,1,0,0,1,0,0
Dietary Nanoplastics are Associated with Non-glycocaliceal Mesenteric Endothelial Dysfunction in ApoE-/- mice,"MS3, Daniel Machin, PhD3, Matt Justus, MS1, Andrea Iturralde-Carillo, MD1, Brittany B. Coffman, MD4, Rowza T. Rumma, MD1, Carolyn Pace, BS1, Matthew Campen, PhD2, Ross M. Clark, MD, MBA, FSVS1,3 1 University of New Mexico School of Medicine, Department of Surgery 2 University of New Mexico College of Pharmacy, Department of Pharmaceutical Sciences 3 University of New Mexico School of Medicine, Department of Cell Biology and Physiology 4 New Mexico Veteran’s Affairs Health Care System, Pathology and Laboratory Medicine Introduction: The glycocalyx is a multifunctional dynamic structure involved in the vascular response to inflammation, dietary changes, and shear stress. The effects of diet introduced micronanoplastics (MNPs) on endothelial cell dysfunction are largely unknown. Utilizing animal models of atherosclerosis development, such as the ApoE-/- mouse, allows for study of MNP-diet interactions in a controlled environment. We aim to investigate the effects of dietary ocean-derived MNPs on the glycocalyx and endothelial cell dysfunction. Methods: Adult male and female ApoE-/- mice (n=5-7/group) were fed standard or Western diet (WD) with and without 1% (w/w) added ocean MNPs milled into the chow. After 6 or 12 weeks of exposure, animals underwent acetylcholine and flowmediated dilation of isolated mesenteric arteries to evaluate endothelial cell function. GlycoCheck of the mesenteric arteries evaluated microvascular density, RBC velocity, and perfused boundary region to evaluate the glycocalyx thickness. Hematologic testing was performed via cardiac puncture of the right ventricle. Results: Animal weights did not differ between MNP-fed and control (non-MNP) animals within diet groups. WD-fed animals had mean weight of 29 g at week 6 compared to 25 g in standard chow group (P=0.02). Flow-mediated dilation in MNP-fed animals eating a WD was significantly impacted after a pressure gradient change of 20 cmH2O and 40 cmH2O compared to the non-MNP group (P=.006, .0012), with max dilation being 35% and 82% respectively (P=0.009). Acetylcholine induced dilation demonstrated a significant difference at 10-5 M concentration (P=0.008), but no significant differences in other concentrations or maximum dilation. There were no significant differences in microvascular density (µm/mm2), RBC velocity (µm/sec), Perfused Boundary Region (µm), or hematologic testing. Conclusions: These data demonstrate that dietary MNPs when paired with Western diet in an atherogenic-prone animal model, have significant endothelial cell dysfunction despite preservation of the glycocalyx. Western diet has been shown in other studies to improve the glycocalyx properties, which may serve as a barrier to the effects of glycocalyx changes from MNPs. Given the effects of the Western diet on the glycocalyx, further studies of MNP exposure on the glycocalyx outside of the atherogenic-prone model are needed to determine the mechanistic relationship.",CONF_3317,Erin Risotto-Urbanowicz,,2026.0,CONFERENCE,0,0,0,0,,,,0,1,,0,0,1,0,0,0,0,0,0,0,1,0,0,0,1,0,0,0,0,0,0,0,1,0,1,0,1,0,0,,0,0,0,0,0,1,1,0,0,0,1,0,0,0,0,0,1,1,0,0,1,0,0,0,0
Eco-corona-based Characterization of environmentally weathered microplastics using Ultra-performance Liquid,"algorithms. Oluniyi O. Fadare1, Nicole M. Dennis2, Jeremy L. Conkle3 1 Department of Physical Sciences, Eastern New Mexico University, Portales, NM, USA 2 Department of Environmental and Global Health, University of Florida, Gainesville, FL, USA 3 Delaware River Basin Commission, Trenton, NJ, USA The adsorption mechanisms and carrier effect in microplastics (MPs) are crucial to assessing their transport, fate, toxicity, and environmental risk. However, MP adsorption studies are complicated due to complex matrices with various environmental constituents, including natural organic matter, eco-proteins, organic pollutants, metals, and microbial colonization. In this study, we develop a new approach to examine corona formation and the characterization of organic compounds on MPs from environmental exposures. MPs were separated from marine particulate organic matter. This was done using three separation methods (NaOH, Formic Acid, and n-Hexane) or by hand (MPm). These plastic particles, as well as pristine microplastics (MPp), were analyzed using attenuated total reflectance Fourier transform infrared spectroscopy (ATR-FTIR) and an unsupervised machine learning algorithm. Spectral integration of characteristic peaks for carbohydrate: protein ratio for each sub-fraction was compared with the MPm and MPp. High-resolution mass spectrometry (HSA-14CHRMS) was used to quantify organic pollutants on the surface of isolated MPs. A total of 1400 ATR-FTIR spectra were collected for polyethylene, polystyrene, and polypropylene in each group. Unsupervised machine learning results showed promise as a tool for environmental MP characterization, achieving 72 -97% accuracy across all groups and polymer types. The MP separation methods showed variation in types and amounts of environmental constituents present on the surface of the MPs. Organic pollutants found on the MP included a stimulant (Caffeine), an anesthetic (Lidocaine), a progestin (Norethindrone), a synthetic fragrance (Tonalide, Galaxolide) sunscreens/cosmetics/personal care products (Benzophenone-3), a plasticizer, an extractant, a flame retardant, and a defoamer (Tributyl phosphate, Tris(2carboxyethyl)phosphine, Tributoxyethyl phosphate, Diisononyl phthalate, Diisodecyl phthalate, Triphenyl phosphate, Tributoxyethyl phosphate) in the positive mode with only Bisphenol A found in the negative mode. Concentrations ranged from 1.67 – 79.9 (0.001 ± 3.63) ng g-1. This study provides a novel approach to how environmentally weathered microplastics could be effectively identified, enhances our knowledge of microplastic eco-corona formation, and demonstrates the carrier tendency and adsorption of organic pollutants on microplastics in the natural environment.",CONF_3318,Chromatography,,2026.0,CONFERENCE,0,0,0,0,,,,0,1,,0,0,0,1,0,0,0,0,0,0,0,0,1,0,0,0,0,0,0,0,0,1,1,0,1,0,1,0,0,,0,0,0,0,0,1,0,0,1,0,0,0,0,0,0,0,0,1,0,0,0,0,0,0,0
Evaluating EpiIntestinal® Tissue as a Physiologically Relevant In Vitro Model to Assess Nanoplastic Transport,"Exposure to micro- and nanoplastics (MNPs) has become a critical area of investigation and public health concern. Increasing evidence demonstrates that MNPs are ubiquitous in the environment and are present in our food chain and water supply. Despite the growing literature on their presence in human biological matrices, including the brain, liver, and kidney, the mechanisms by which these particles are absorbed and transported across the intestinal barrier are still being explored. Currently, the limited studies related to physiologically relevant in vitro models to assess the intestinal absorption of nanoplastics represent a significant limitation in advancing the understanding of human health risk assessment. The primary aim of this study is to evaluate the feasibility of using EpiIntestinal® tissue, a 3D human-derived intestinal model, to assess nanoplastic permeability across the intestinal epithelium. EpiIntestinal tissue incorporates specialized cell types of the human small intestine and replicates key biological functions, including maintaining tight junction integrity, brush border activity, and responding to inflammatory and metabolic stimuli. These properties make it a promising alternative to traditional cell lines for evaluating nanoplastic transport and toxicity. In this study, EpiIntestinal tissue were mounted onto modified Franz diffusion cells. The receptor compartments were filled with a nutrient-rich maintenance medium and maintained at 37 ± 0.5 °C under continuous stirring. Fluorescently labeled polystyrene nanobeads (25nm and 100nm, 10ug/mL) with and without the perturbant dextran sodium sulfate were applied to the apical surface to mimic luminal exposure conditions. Fluid from the donor and receptor chambers was collected to quantify nanoplastic permeation using fluorescence spectroscopy, and post-exposure tissues were evaluated for integrity and nanoplastic localization through confocal microscopy. The outcomes of this research determine the reproducibility and sensitivity of EpiIntestinal tissue for assessing nanoplastic transport and establish this proof-of-concept model as a viable platform for MNP absorption studies. This experimental model will allow us to explore the mechanisms of MNP absorption and distribution.",CONF_3319,Olivia Cartron,"1 University of New Mexico, Department of Biochemistry & Molecular Biology | 2 University of New Mexico College of Pharmacy, Department of Pharmaceutical Sciences",2026.0,CONFERENCE,0,0,0,0,,,,0,1,,0,0,0,0,0,0,0,0,1,0,1,1,1,0,0,0,1,1,0,0,0,1,1,0,1,0,1,0,0,,0,0,1,1,0,1,1,0,0,1,0,0,0,0,0,0,1,1,1,0,0,0,1,0,0
