Developing Multispectral Fluorescence Imaging (FIMAP) for accessible Microplastic Detection and Identification in Environmental Systems,"Fluorescence imaging has emerged as a promising technique to enhance the visibility of plastic particles and enable their classification based on fluorescence characteristics. However, conventional image segmentation methods often suffer from low signal-to-noise ratios, uneven illumination, thresholding inconsistencies, and false positives arising from natural organic matter (NOM). To address these challenges, this study introduces the Fluorescence Imaging for Microplastic Analysis Platform (FIMAP), a retrofitted multispectral imaging system equipped with four optical filters and five excitation wavelengths. FIMAP enables comprehensive characterization of the fluorescence behavior of ten Nile Red-stained polymers—high-density polyethylene (HDPE), low-density polyethylene (LDPE), polypropylene (PP), polystyrene (PS), expanded polystyrene (EPS), acrylonitrile butadiene styrene (ABS), polyvinyl chloride (PVC), polycarbonate (PC), polyethylene terephthalate (PET), and polyamide (PA, commonly known as Nylon)—while effectively excluding NOM through Fenton oxidation. Robust particle segmentation is achieved using K-means clustering (Intersection over Union = 87.7%), and classification is performed using a 20dimensional color coordinate multivariate nearest neighbor approach for MPs larger than 3.14 mm, yielding 90% precision, 90% accuracy, 100% recall, and a 94.7% F1 score. Among the ten polymers, only polystyrene was occasionally misclassified as expanded polystyrene. For smaller MPs (35–104 µm), classification accuracy declined, likely due to reduced fluorescent dye sorption, limited pixel representation, and camera instability. FIMAP has demonstrated its efficacy in detecting MPs across diverse environmental matrices, including surface waters, avian stomachs, and breast milk, and is currently being deployed in Philadelphia to monitor the spatial and temporal trends of MPs. Additionally, FIMAP is being integrated into higher-magnification imaging systems, such as microscopes, and trained on environmentally sourced MPs to further enhance identification accuracy. In summary, FIMAP establishes an automated, high-throughput framework for comprehensive microplastic detection and lays the foundation for robust spectral classification across diverse and complex environmental matrices.",CONF_3245,sible Microplastic Detection and Identification in,,2026.0,CONFERENCE,0,0,0,0,,,,0,1,,0,0,0,0,0,0,0,0,0,0,0,0,1,0,0,0,0,0,0,0,0,1,1,0,0,0,1,0,0,,0,0,0,0,0,1,0,0,1,0,0,0,0,0,0,0,0,1,0,0,0,0,0,0,0
"Elevated temperatures and extended periods accelerate the release of nano- and microplastics from thermoplastic packaging into foods, raising the risk of human exposure","Polypropylene (PP) and polyethylene terephthalate (PET) are commonly used food contact packaging materials in a variety of applications, from drinking water and beverage bottles to infant formula bottles, single-use cups, and food storage containers, because of their excellent barrier properties and cost efficiency. However, several studies have shown that these packaging materials can leach nano- and microplastics (NMPs) into foods and drinks. Although some studies have examined how contact time and temperature affect the total amount of release, no systematic work has addressed their effects on release kinetics or particle release mechanisms. In this work, we systematically examined the release kinetics of NMPs from PP and PET, under multiple temperature conditions with two types of food simulants (i.e., ultrapure water and 3% acetic acid). To reduce the influence of plastic additives on particle release, we used standard-grade PP and PET rather than consumer products. We exposed PP and PET to ultrapure water (simulating bottled water, coffee, and tea) and 3% acetic acid (simulating beverages, juices, and syrups) at temperatures from 20 to 90 °C, from 0.5 minutes to 10 days. To understand release mechanisms, we examined plastic surfaces before and after exposure for morphology, carbonyl index, surface roughness, and chemical composition. NMP release from both PP and PET increased strongly with temperature and contact time and was approximately linear over the exposure period. Short, high-temperature exposures (70–90 °C) produced particle counts within 4 hours that exceeded 94 those observed after 10 days at 20–40 °C, indicating much faster release at elevated temperatures. PET followed the same trends as PP but released fewer particles under comparable conditions. In all experiments, NPs dominated over MPs: at 90 °C and 4 hours, NPs outnumbered MPs by factors of about 16 for PP and 23 for PET. Overall, these results show that modest increases in temperature and duration substantially enhance NMP release from common food-contact plastics, with the released particles predominantly in the nano-size range. Keywords: Plastic food packaging, nano- and microplastics, release kinetics, human exposure.",CONF_3247,Muhammad Saiful Islam,"Yongfeng Lu2, Yusong Li1 | 1 Department of Civil and Environmental Engineering, University of Nebraska-Lincoln, Lincoln, Nebraska 68588-0531, United States | 2 Department of Electrical & Computer Engineering, University of Nebraska-Lincoln, Lincoln, Nebraska 68588-0511, United States | 3 Department of Mechanical & Materials Engineering, University of Nebraska-Lincoln, Lincoln, Nebraska 68588-0526, United States",2026.0,CONFERENCE,0,0,0,0,,,,0,1,,0,0,0,0,0,0,0,0,0,0,1,0,0,0,0,0,0,0,0,0,0,1,1,0,1,0,0,0,0,,0,0,0,0,0,1,0,0,1,0,0,0,0,0,0,0,0,0,0,0,0,0,0,0,0
Engineering Vibrio natriegens for degrading and assimilating poly(ethylene terepthalate) microplastics,"Poly(ethylene terephthalate) (PET) is among the most widely used plastics, yet its high durability and limited recyclability have led to global environmental accumulation. Inefficient recycling practices and persistent littering generate PET microplastics, which pose risks to marine ecosystems and potential hazards to human health through ingestion and exposure. Addressing this challenge requires innovative, sustainable strategies for PET degradation under environmentally relevant conditions. In this work, we harness synthetic biology to develop Vibrio natriegens—a fast-growing, nonpathogenic marine bacterium— as a whole-cell biocatalyst for PET depolymerization and assimilation in brackish environments. We engineered V. natriegens to express and surface-display a two-enzyme system from Ideonella sakaiensis—IsPETase and IsMHETase— enabling the breakdown of PET into its monomers, terephthalic acid (TPA) and ethylene glycol (EG), at 30°C in seawater like media. Concurrently, we enhanced the organism’s metabolic capacity to grow on PET-derived intermediates. Through metabolic engineering and directed evolution, we developed strains capable of utilizing TPA and bis(2-hydroxyethyl) terephthalate (BHET) as sole carbon sources, achieving stable growth. This integrated system demonstrates a novel approach to biologically degrade and valorize PET microplastics in marine-like conditions. By coupling PET hydrolysis with microbial assimilation, our work lays the foundation for sustainable biotechnological solutions to mitigate microplastic pollution. Such strategies have the potential to reduce environmental persistence of microplastics, decrease human exposure, and ultimately improve ecosystem and public health outcomes.",CONF_3249,Tianyu Li,"1 North Carolina State University, Chemical and Biomolecular Engineering Department | 2 North Carolina State University, Center for Human Health and the Environment",2026.0,CONFERENCE,0,0,0,0,,,,0,1,,0,0,0,0,0,0,0,0,0,0,0,0,0,0,0,0,0,0,0,0,0,0,1,0,1,0,0,0,0,,0,0,0,1,0,1,0,0,1,0,0,0,0,0,0,1,0,0,0,0,0,0,0,0,0
Environmental microplastics - from our households to our rivers and oceans and back to our table Granek,"Katherine1 1 Portland State University 2 NOAA Corps 3 ODEQ 4 The Ocean Conservancy 5 Oregon State University Sources of environmental microplastics into urban environments include washing machines, and dryer vents. However, the extent to which these various sources contribute microplastics into our air and water have not been explicitly compared. To assess whether washing machines or dryer vents are greater contributors of environmental microplastics, we simultaneously installed and sampled filters on household washing machines and dryers across two coastal communities for a 30 day period. We quantified the dry weight of the microparticles in each of the filter types and compared within and between households. We also surveyed users about the ease of use of each filter type. Washing machine and dryer type and age affected the amount of microparticles collected in the filters. The efficacy of the washing machine and dryer vent filters at trapping microplastics and the user experience can inform policy for wider application to minimize environmental microplastics from laundry. Reductions in microfibers entering the environment is essential to reducing exposure by organisms, including humans.",CONF_3250,"lds to our rivers and oceans and back to our table""",,2026.0,CONFERENCE,0,0,0,0,,,,0,1,,0,0,0,0,0,0,0,0,0,0,0,0,0,0,0,0,0,0,0,0,0,0,0,0,1,0,1,0,0,,0,0,0,0,1,1,0,1,0,0,0,0,0,0,0,0,0,1,0,0,0,0,0,0,0
Evaluating microplastic particles as vectors of exposure for plastic additive chemicals using a food web model,"Microplastic particles (MPs) represent potential hazards for humans and wildlife, including as vectors for chemical exposure (e.g. plastic additives and pollutants sorbed from the surrounding environment). The leaching of chemicals from MPs has been identified as a potential exposure pathway but the relative magnitude of this pathway under environmentally relevant conditions remains unclear. Here, we describe a modification of the ACC-HUMANSTEADY bioaccumulation model to include dietary exposure to MPs containing either accumulated chemicals from the surrounding environment or embedded plastic additive chemicals (PACs). Chemical transfer to humans and wildlife is described using two-film resistance concepts assuming spheroidal or cylindrical particles of different sizes. The relative contribution of MPs and environmental media to the estimated daily chemical intake in humans was assessed in various exposure scenarios, for a range of hypothetical chemicals with varying octanol-water and air-water partition coefficients (KOW and KAW, respectively; i.e. 0 <log KOW <8 and -5 < log KAW < 3). Results imply that MPs could act as sources of exposure to chemical additives when the ingestion rate of 1 µm MPs is >10 mg d-1, and the concentration of hydrophobic plastic additive is >5% wt wt-1. The contribution made by MPs as vectors of exposure decreased with increasing particle size and decreasing ingestion rates of MPs. Human health risks were evaluated for four specific PACs to illustrate the application of the model for risk assessment. Risks were negligible when the ingestion rate of MPs was <100 µg d-1. Uncertainties are high regarding the characterization and quantification of ingestion of MPs by humans and wildlife, including particle sizes and polymer composition, as well as on the presence of PACs in MPs. These data gaps need to be addressed if the issue of MPs as vectors of chemical exposure is to be fully understood. The work illustrates that mechanistic models, which account for all major exposure pathways, can be used to identify the importance of different exposure pathways, help prioritize research needs and support decision making.",CONF_3251,Todd Gouin,"1 TG Environmental Research, Sharnbrook, Bedfordshire, UK | 2 School of Geography, Geology and the Environment, University of Leicester, Leicester, UK",2026.0,CONFERENCE,0,0,0,0,,,,0,1,,0,0,0,0,0,0,0,0,0,0,0,0,0,0,0,0,0,0,0,0,0,1,1,0,1,0,1,0,0,,0,0,0,1,0,1,0,0,1,0,0,0,0,0,0,1,0,0,0,0,0,0,0,0,0
Evaluating the Effects of Nanoplastic Exposure on Amyloid-β Aggregation and Neurotoxicity,"Plastic pollution has emerged as a global concern, with growing attention to the potential health impacts of nanoplastics. While environmental distribution is well documented, their neurotoxic potential and possible role in neurodegenerative processes remain poorly understood. In particular, links between nanoplastic exposure and Alzheimer’s disease pathology have yet to be clarified. This work investigates how nanoplastics influence amyloid-β (Aβ) fibrillization kinetics and neuronal health. A cell-free in vitro assay was utilized to examine polymer-specific effects of 50 nm polystyrene (PS) and poly(methyl methacrylate) (PMMA) nanoparticles on Aβ aggregation. Increasing concentrations of both polymers shifted the fibrillization profile, altering the time to fibril formation. These findings guided subsequent studies in primary cortical neurons isolated from embryonic day 15.5 mice. Cultures were exposed on in vitro day 7 to a nine-point concentration range (0.8–0.003125 µg/µL) of PS or PMMA nanoparticles for 24 or 120 hours. Neurotoxicity was assessed via fluorescence-based live/dead cell assays and reactive oxygen species (ROS) detection. Exposure to both PS and PMMA does not induce significant changes in percentage of dead cells or ROS at multiple concentrations when compared to the control. Neurons were also co-exposed to synthetic Aβ (1–42) at concentrations of 2.5 or 1.25 µM together with 50 nm polystyrene (PS) nanoplastic particles at 0.05 or 0.00625 µg/µL for 120 hours, in an effort to reproduce the fibrillization phenomenon observed in the cell-free assay within primary neuronal cultures. The results showed a significant decrease in fluorescent signal labeling Aβ peptide and fibrils in the co-exposure group of 2.5 uM peptide with 0.05 ug/ul PS when compared to the control. These findings suggest that the current in vitro neuronal model and endpoints used in this study may not be optimal for detecting subtle or delayed neurotoxic effects of nanoplastics. Further optimization of the Aβ co-exposure model, including refinement of exposure conditions, time windows, and analytical endpoints, will be necessary to more effectively evaluate how nanoplastics may contribute to neurodegenerative disease processes in vitro.",CONF_3252,Sydney C. Stradtman,Oregon State University,2026.0,CONFERENCE,0,0,0,0,,,,0,1,,1,0,1,0,0,0,0,0,0,0,0,1,0,0,0,0,0,0,0,0,0,1,1,0,1,0,1,0,0,,0,0,0,1,0,0,1,0,0,1,1,1,0,0,0,0,0,1,0,1,0,0,1,0,0
Evaluation of Micro- and Nanoplastics Accumulation in Alzheimer's and Related Dementias,"Micro- and nanoplastics (MNPs) are increasingly recognized as an emerging environmental contaminant of concern in human health. However, their mechanisms for uptake within the body and potential role on neurodegenerative disorders are still not well understood. Although a direct link between MNP exposure and Alzheimer’s disease or related dementias has not yet been established, accumulating evidence suggests differential patterns of MNP accumulation across neurodegenerative diseases, indicating potential disease-specific vulnerabilities or transport mechanisms. In this study, we quantified MNPs accumulation in postmortem brain tissues from individuals diagnosed with progressive supranuclear palsy, familial Alzheimer’s disease, Alzheimer’s disease, dementia with Lewy Bodies, and frontotemporal dementia, compared against cognitively unaffected control tissue. Using pyrolysis-gas chromatography/mass spectrometry (py-GC/MS), we determined polymer type, and total MNP concentration within isolated brain tissues. As a result, across all dementia types, the mean MNP concentration was approximately 1,400ug/g of tissue, which was considerably higher than the 460ug/g average detected in cognitively unaffected controls. Notably, Alzheimer’s disease and dementia with Lewy Bodies exhibited significantly elevated levels of polypropylene compared to controls, indicating a potential selective retention or transport of this particular polymer type in these neurodegenerative disorders. While these findings do not prove causation, they do reveal consistent trends of increased MNP burden across multiple forms of dementia. This study emphasizes the importance of investigating environmental plastic exposure as a potential factor influencing neurodegenerative processes and further highlights the need for mechanistic studies exploring MNP transport, accumulation, and interaction with brain tissue and disease progression.",CONF_3253,Kiran Bhaskar,"1 Department of Molecular Genetics and Microbiology, University of New Mexico School of Medicine, Albuquerque, NM | 2 Department of Pharmaceutical Sciences, University of New Mexico College of Pharmacy, Albuquerque, NM",2026.0,CONFERENCE,0,0,0,0,,,,0,1,,1,0,0,0,0,0,0,0,0,0,0,1,0,0,0,0,0,0,0,0,0,1,0,0,1,0,1,0,0,,1,0,0,1,0,1,1,0,0,0,0,0,0,0,0,1,0,1,0,0,0,0,1,0,0
Evaluation of UV-C sterilization effects on N95 mask structural integrity and mask performance for safe reuse.,"Prior to the COVID-19 pandemic, the use of commercial masks outside of hospitals was primarily limited to those living in densely populated areas with poor air quality (e.g., Delhi, India; Lahore, Pakistan; Dhaka, Bangladesh; Chengdu, China, etc.). During the pandemic, the demand for this personal protective equipment (PPE) far outstripped the supply, and sterilization procedures were investigated to allow for the reuse of masks. However, UV sterilization was not recommended by mask manufacturers such as 3M, suggesting that this method was damaging to the non-woven fibers of N95 and other masks. In this work, we investigate the impact that repeated cycles of exposure to UV C (254 nm) have on single-use mask (N95) fibers. Using Scanning Electron Microscopy (SEM) and image processing software - ImageJ, N95 masks’ layers were analyzed to determine the void fraction of mask layers before and after exposure. To correlate the material properties of masks prior to and following exposure to filtration efficiency, we exposed the N95 masks to aerosols like woodsmoke, room air, and nebulized saline mist, examining the aerosol properties and particle size distribution using a laser aerosol spectrophotometer. We found that exposure to UV for the time recommended for decontamination (15 minutes) yielded sufficient damage to the non-woven fibers of N95 masks that particulates less than 200nm (approximately the size of COVID particles) easily passed through the masks. We therefore conclude that the use of UV sterilization is not recommended to extend the life of single-use PPE masks. As the acute experiences of the pandemic have receded, the cost and availability of PPE have normalized, and well-funded populations have ceased to focus on the issue of sterilization and reuse. However, members of at-risk communities are still grappling with ways to best adapt to supply chain shortages and masking needs. Therefore, these results will be of interest to those seeking to understand how UV-C affects the reusability of N95 masks for purposes such as the filtration of pollutants, nano and microplastics, and other potential inhaled pathogens.",CONF_3254,Sudha Ananthakrishnan,University of New Mexico,2026.0,CONFERENCE,0,0,0,0,,,,0,1,,0,0,0,0,0,0,0,0,0,0,0,0,0,1,0,0,0,0,0,0,0,0,1,0,1,1,1,0,0,,0,0,0,0,1,1,0,1,0,0,0,0,0,0,0,0,0,1,0,0,0,1,0,0,0
Exposure of Micro- and Nano-plastics in Common Soft Drinks in the US,"Microplastics (≤5 mm) have been detected in various environments and are known to threaten over 1,300 aquatic and terrestrial species. Alarmingly, they have also been found in human tissues, organs, and bodily fluids, including blood cells, sputum, lungs, liver, and breast milk. These particles are common in everyday products such as food, beverages, and cosmetics, and they can easily enter the human body through ingestion, inhalation, and skin absorption. Although many efforts have been made, there remain challenges in identifying plastic particles that are less than 1 µm, known as 87 nanoplastics, which have the potential to cross biological barriers. Thus, this study aims to fill that research gap by examining the presence and concentration of micro- and nanoplastics (MNPs) in popular soft drinks in the U.S., using a combination of scanning electron microscopy (SEM) and stimulated Raman scattering (SRS). Soft drinks, after being oxidized to eliminate sugars and colorants, were analyzed using SEM and SRS to detect and quantify MNPs. Our preliminary SEM results show that the detected materials vary in size and shape and exhibit moderate carbon concentrations, aligning with the carbon-based structure of plastic polymers. SRS analysis indicates that a 12-ounce can of Coca-Cola contains approximately 3.74 × 10⁶ MNPs, of which 78% are nanoplastics. The MNP level is about 15 times higher than that found in bottled water. Notably, nearly 50% of the identified MNPs were found to be polyethylene. Ongoing research will further investigate the concentration of MNPs in different soft drinks and container types, including glass and plastic bottles, as well as cans.",CONF_3255,Han Ngoc Nguyen-Luu,"1 Undergraduate Program of Sustainable Development, Columbia University | 2 Lamont-Doherty Earth Observatory, Columbia University) | 3 Department of Chemistry, Columbia University",2026.0,CONFERENCE,0,0,0,0,,,,0,1,,0,0,0,0,0,0,0,0,0,0,1,0,0,1,0,0,1,0,0,0,0,0,0,0,1,0,1,0,0,,1,0,0,0,0,1,1,0,0,0,0,0,0,1,0,0,0,1,0,0,1,1,0,0,0
Exposure to Polystyrene Microplastics Potentiates Macrophage-Mediated Proinflammatory Responses,"Although MPs are widespread, the biological consequences of MP exposure remain poorly understood, particularly regarding their effects on the immune system. Macrophages play a central role in innate immunity; however, emerging evidence suggests they have limited capacity to phagocytose MPs, potentially leading to cellular dysfunction and dysregulated immune responses. The objective of this study was to evaluate the effects of polystyrene MPs on macrophage polarization and function using human and mouse macrophage cell models. Here, THP-1 human monocytes were differentiated into macrophages with phorbol 12-myristate 13-acetate (PMA) and were polarized toward either M1 (via lipopolysaccharide, LPS) or M2 (via IL-4) phenotypes. Cells were then exposed to 1 µm or 5 µm polystyrene MPs at concentrations of 0, 10, or 100 µg/mL for up to six days. Various endpoints related to monocytic function and polarization were assessed such as cellular metabolic activity, phagocytic capacity, cytokine secretion, and pro-inflammatory gene expression. Results showed that the highest concentration of MPs significantly suppressed THP-1 monocyte growth. Interestingly, exposure to MPs enhanced the metabolic and phagocytic activity of M1 macrophages, suggesting a heightened proinflammatory phenotype. Consistent with this, MP-treated M1 macrophages exhibited increased secretion of IL-1β and TNF-α following LPS stimulation. Conversely, MPs suppressed the secretion of the anti-inflammatory cytokine IL-10 in M2 macrophages, indicating impairment of a pro-resolving phenotype. Together, these findings suggest that MPs exacerbate inflammatory responses while suppressing anti-inflammatory pathways, thereby disrupting macrophage polarization dynamics. Complementary studies are currently underway to validate these findings using primary mouse alveolar macrophage-like models. Results from the present study provide important insight into the immunotoxicity of microplastics and will serve as a foundation for future mechanistic investigations. Funding: This work was supported by the NIEHS Core Center Grant P30ES032755; the UNM Center for Metals in Biology and Medicine through NIGMS Grant P20 GM130422; the NIEHS UNM METALS Superfund Research Program Grant P42 ES025589; and the UNM Comprehensive Cancer Center Grant NCI P30CA118100.",CONF_3257,Lauren K. Heine,,2026.0,CONFERENCE,0,0,0,0,,,,0,1,,0,0,0,0,0,1,0,0,0,0,0,0,0,1,0,0,0,0,1,0,0,1,1,0,1,0,1,0,0,,0,0,0,0,1,1,0,0,0,0,1,0,0,0,0,0,1,0,0,0,0,0,0,1,0
