doc_id,title,authors,doi,pub_date,year,abstract
PMC12827314,The single and combined effects of deltamethrin and polyethylene microplastics on the development and biochemical responses of  Xenopus laevis  in early life stages,"Duygu Ozhan Turhan, Cihan Anıl Benli, Muhittin Yurekli, Abbas Güngördü",10.1007/s10646-026-03028-5,2026-01-23,2026,"The online version contains supplementary material available at 10.1007/s10646-026-03028-5. The co-occurrence of microplastics and pesticides in freshwater ecosystems raises concerns for aquatic organisms. However, their combined effects remain poorly understood. In this study, the single and combined effects of deltamethrin (DEL) and polyethylene microplastics (PE-MPs) were investigated in the early life stages of  Xenopus laevis . Embryonic developmental toxicity was evaluated under standardized Frog Embryo Teratogenesis Assay– Xenopus  (FETAX) conditions in embryos, and sublethal biochemical responses were also assessed in embryos and tadpoles. In the first phase, embryos were exposed for 96 h to a concentration range of DEL (3.125–6,400 µg/L) and PE-MPs (50–1,000 mg/L) to estimate the median lethal concentration (LC 50 ) and the median effective concentration for malformation (EC 50 ), as well as the teratogenic index (TI). In the second phase, assays were performed at DEL 2.72 and 13.6 µg/L (alone or combined with 100 mg/L PE-MPs) and PE-MPs 50 and 250 mg/L alone, assessing malformation and lethality in embryos and enzymatic biomarkers in both embryos and tadpoles. DEL caused significant embryotoxicity, with 96 h LC 50  and EC 50  values of 68.0 µg/L and 7.58 µg/L, respectively, and a TI of 8.97. PE-MPs alone did not induce lethality or malformations but caused biochemical alterations. Combined exposures produced additive (glutathione S-transferase, GST; carboxylesterase, CaE) and antagonistic (catalase, CAT; acetylcholinesterase, AChE) patterns; notably, CAT showed a synergistic pattern in embryos based on interaction index analysis. In tadpoles, 250 mg/L PE-MP concentration inhibited glutathione reductase (GR) and AChE activity, suggesting life stage–dependent sensitivity. These findings underscore the complexity of mixture toxicity and emphasize the need for combined exposure assessments in amphibian ecotoxicology."
PMC12830131,"Microplastics in poultry: Sources, bioaccumulation and human health consequences","Susmita Sarker Bristi, Rafiqul Islam",10.1016/j.psj.2026.106387,2026-01-03,2026,"• Microplastics enter poultry via feed, water, litter, environment and processing equipment. • MPs can accumulate in different organs such as gastrointestinal tract, liver, kidneys, spleen, muscles, etc. • Exposure disrupts gut microbiota, causes oxidative stress and impairs growth, meat quality and egg production. • Contaminated poultry products pose potential health risks to humans. • Key strategies such as reducing plastic use, improving detection methods, raising awareness and implementing proper safety regulations should be adopted to minimize associated risks."
PMC12837546,Size-Dependent Tissue Translocation and Physiological Responses to Dietary Polystyrene Microplastics in  Salmo trutta,"Buumba Hampuwo, Anna Duenser, Elias Lahnsteiner, Thomas Friedrich, Franz Lahnsteiner",10.3390/ani16020285,2026-01-16,2026,"Microplastics are widespread pollutants found in freshwater, glaciers, and even the air. This study examined how polystyrene microplastics (PS-MPs; 1–10 µm) affect brown trout, a temperate freshwater fish important for ecology and aquaculture. Fish were fed polystyrene microplastic-spiked diets of approximately 5 million MPs per gram of feed for 21 days, followed by 90 days on clean feed. Small PS-MPs (1–5 µm) moved from the gut to the liver and muscle, while larger MPs (10 µm) mostly stayed in the intestine, with a small fraction reaching muscle tissue. Most biochemical markers were unaffected, but some enzymes, including trypsin, which is responsible for protein digestion, and peroxidase, which helps remove reactive oxygen species, were significantly decreased after 21 days. Importantly, MPs persisted in muscle tissue even after depuration, representing a clear concern for human food safety."
PMC12844225,Kinetics and Potential Mechanisms of LDPE and PBAT Microplastics Biodeterioration by Soil Bacteria  Bacillus cereus  L6,"Jiayang Hu, Tianyu Liu, Jinpeng Zhang, Yong Yu, Jincai Ma, Yanjun Li",10.3390/microorganisms14010179,2026-01-14,2026,"Low-density polyethylene (LDPE) and poly (butylene adipate-co-terephthalate) (PBAT) agricultural films are major components of microplastics (MPs) and their contamination in agriculture due to their difficulty to recycle. However, potential degradation mechanisms of MPs from LDPE and PBAT in agricultural soils are still unclear. Here, we isolated a strain of  Bacillus cereus  L6 from long-term agricultural MP-contaminated soil and analyzed its potential biochemical pathways involved in LDPE and PBAT turnover through functional prediction from shotgun genome sequencing. After 28 days of incubation with MPs,  Bacillus cereus  L6 caused a net mass loss of 0.99% LDPE-MPs/28 days and 3.58% PBAT-MPs/28 days. The surfaces of LDPE and PBAT degraded in bioassays added with  Bacillus cereus  L6 showed wrinkles, cracks, and pits, accompanied by an increase in roughness. The crystallinity and thermal stability of both LDPE- and PBAT-MPs were decreased and the hydrophobicity of PBAT-MPs was reduced. Whole-genome sequencing analysis showed that  Bacillus cereus  L6 potentially encoded genes for enzymes related to the biodeterioration of additives in LDPE and PBAT. Moreover, genomic CAZymes predictive analysis showed that genes related to oxygenases and lyases were annotated in the strain L6 Auxiliary Activities family. These findings offer a theoretical foundation for deeper exploration into the degradation and metabolic processes of MPs from discarded agricultural plastics in the environment."
PMC12845502,Natural Deep Eutectic Solvents for PHB Recovery: Mechanistic Insights and Implications for Sustainable Downstream Processing,"Antonio Zuorro, Roberto Lavecchia, Jefferson E. Contreras-Ropero, Janet B. García-Martínez, Andrés F. Barajas-Solano",10.3390/polym18020169,2026-01-08,2026,"The growing concern over plastic pollution and the widespread presence of micro- and nanoplastics has renewed interest in polyhydroxybutyrate (PHB) as a biodegradable alternative; however, its industrial deployment remains constrained by costly recovery operations with a high environmental burden. This study examines how PHB biosynthesis and intracellular organization, physicochemical properties, and the characteristics of the producing microorganism influence the performance of conventional recovery routes, including extraction with organic solvents, alkaline/oxidative chemical digestion, and enzymatic–physical schemes coupled with mechanical disruption. Based on this foundation, quantitative data are analyzed for PHB content in bacteria, mixed microbial cultures, cyanobacteria, and microalgae, along with extraction yields, polymer purity, and solvent recyclability in processes employing chlorine-free solvents, green solvents, and hydrophobic natural deep eutectic solvents (NaDESs) formulated with terpenes and organic acids. The analysis integrates mechanistic perspectives on NaDES–cell and NaDES–PHB interactions with solvent design criteria, biorefinery configurations, and preliminary evidence from technoeconomic and life cycle assessments. The findings identify NaDES as an up-and-coming platform capable of reconciling biopolymer quality with the principles of green chemistry while delineating critical gaps in recovery efficiency, viscosity management, solvent recycling, and pilot-scale validation."
PMC12845532,Fungal Degradation of Microplastics—An Environmental Need,"Rachel R. West, Mason T. MacDonald, Chijioke U. Emenike",10.3390/toxics14010070,2026-01-12,2026,"Plastic waste is a global issue due to the popularity of the product. Over time, plastic degrades into smaller particles known as microplastics and becomes harder to deal with as it easily disperses and can be missed by physical catches. Conventional degradation involves environmental forces like ultraviolet (UV) light, water, temperature, and physical abrasion. However, there is increasing interest in microbial plastic degradation, which could positively impact the transformation of (micro)plastics in various environmental matrices. Most of the available research has focused on bacterial degradation, but there is mounting evidence on the impact of fungal degradation. This review discusses conventional and bacterial degradation, then discusses the advantages of fungal involvement in the degradation of microplastics. Biodegradation enhanced by fungal enzymes is a valuable tool that could greatly improve the removal of these microplastic pollutants from the environment. Due to some biochemical complexities, fungi are naturally omnipresent in marine and terrestrial environments under all sorts of climates. Fungi could thrive by themselves or in association with other microorganisms, which could also be applied in non-biotic plastic degradation processes as an alternative to other forms of plastic management in the environment."
PMC12845626,A Cost-Effective Standardized Quantitative Detection Method for Soil Microplastics in Different Substrates,"Xinlei Ling, Yuting Gao, Rongxiang Li, Rongfang Chang, Yanpeng Li, Wen Xiao",10.3390/toxics14010105,2026-01-22,2026,"Microplastics (MPs) are emerging pollutants with widespread global distribution, continuously accumulating in soils and posing risks of cross-media pollution. Current soil MP detection methods lack unified standards, suffering from high inter-laboratory variability and cost, which become key bottlenecks limiting data comparability and global microplastics pollution control. Here, we systematically reviewed soil MPs studies (2020–2024) and based on stepwise verification, we established a standardized, reproducible detection method: soil samples were dried at 80 °C for 12 h; density separation was performed in Erlenmeyer flasks with decantation, 10 s glass rod stirring, and 12 h settling, repeated five times; digestion was conducted using a 1:2 volume ratio of H 2 O 2  to supernatant at 80 °C for 8 h; and MPs were quantified via stereo-microscopy combined with ImageJ. It should be noted that the use of NaCl limits the recovery of high-density polymers (e.g., PVC, PET), and the minimum detectable particle size is approximately 127 µm. The method was validated in sandy, loam, and clay soils, achieving an average recovery rate of 96.4%, with a processing time of 68 h and a cost of USD 9.77 per sample. In contrast to previous fragmented, non-standardized protocols, this workflow synergistically optimizes high recovery efficiency, cost-effectiveness, and broad applicability, offering a low-cost, efficient, and widely applicable approach for soil MPs monitoring, supporting data comparability across studies and contributing to global pollution assessment and the United Nations 2030 Sustainable Development Goals."
PMC12845721,Toxic Effects of Polystyrene Microplastics and Sulfamethoxazole on Early Neurodevelopment in Embryo–Larval Zebrafish ( Danio rerio ),"Fantao Meng, Shibo Ma, Yajun Wang, Chunmei Wang, Ruoming Li, Jiting Wang",10.3390/toxics14010074,2026-01-14,2026,"Microplastics (MPs) and antibiotics have emerged as contaminants of global concern, posing potential threats to ecosystem security and organismal health. To investigate the individual and combined toxicity of microplastics (PS-MPs) and sulfamethoxazole (SMX), we conducted a 120 h acute exposure experiment using embryo–larval zebrafish as a toxicological model. Our findings demonstrate that both PS-MPs and SMX can induce neurodevelopmental toxicity in embryo–larval zebrafish during embryonic development. Notably, PS-MPs and SMX exerted a significant synergistic effect. PS-MPs 1 µm in diameter were restricted to the chorion surface of pre-hatching zebrafish, whereas post-hatching, PS-MPs accumulated mainly in the gut and gills, with accumulation levels increasing progressively with exposure duration. Individual exposure to PS-MPs or SMX reduced spontaneous locomotion, decreased heart rate, and shortened body length in embryo–larval zebrafish. In addition to exacerbating these effects, coexposure further increased the incidence of malformations such as pericardial effusion and spinal curvature. PS-MPs and SMX significantly decreased the levels of dopamine (DA), serotonin (5-HT), and γ-aminobutyric acid (GABA) in zebrafish while also suppressing acetylcholinesterase (AChE) activity and increasing acetylcholine (ACh) levels. Moreover, upon coexposure at high concentrations, PS-MPs and SMX acted synergistically to reduce the levels of DA and GABA. The downregulation of key neurodevelopmental genes ( elavl3 ,  gap43 , and  syn2a ) and related neurotransmitter pathway genes indicates that PS-MPs and SMX impaired structural development and functional regulation of the nervous system. An integrated biomarker response (IBR) index confirmed that PS-MPs and SMX significantly enhanced developmental neurotoxicity during early neurodevelopment in embryo–larval zebrafish through synergistic effects. Our study provides critical toxicological evidence for the scientific assessment of "
PMC12845809,From Kitchen to Cell: A Critical Review of Microplastic Release from Consumer Products and Its Health Implications,"Zia Ur Rehman, Jing Song, Paolo Pastorino, Chunhui Wang, Syed Shabi Ul Hassan Kazmi, Chenzhe Fan, Zulqarnain Haider Khan, Muhammad Azeem, Khadija Shahid, Dong-Xing Guan, Gang Li",10.3390/toxics14010094,2026-01-20,2026,"Microplastics (MPs) are pervasive environmental pollutants, widely distributed from aquatic ecosystems to the terrestrial food chain, and represent a potential route of human exposure. Although several reviews have addressed MP contamination, a critical synthesis focusing on pathways through which consumer goods directly enter food and beverages, along with corresponding industry and regulatory responses, is lacking. This review fills this gap by proposing the direct release of MPs from common sources such as food packaging, kitchen utensils, and household appliances, linking the release mechanisms to human health risks. The release mechanisms of MPs under thermal stress, mechanical abrasion, chemical leaching, and environmental factors, as well as a risk-driven framework for MP release, are summarized. Human exposure through ingestion is the predominant route, while inhalation and dermal contact are additional pathways. In vitro and animal studies have associated MP exposure to inflammatory responses and oxidative stress, neurotoxicity, and genomic instability as endpoints, though direct causal evidence in humans remains lacking, and extrapolation from model systems necessitates caution. This review revealed that dietary intake from kitchen sources is the primary pathway for MP exposure, higher than the inhalation pathway. Most importantly, this review critically sheds light on the initiatives that should be taken by industries with respect to global strategies and new policies to alleviate these challenges. However, while there has been an upsurge in research commenced in this area, there are still research gaps that need to be addressed to explore food matrices such as dairy products, meat, and wine in the context of the supply chain. In conclusion, we pointed out the challenges that limit this research with the aim of improving standardization; research approaches and a risk assessment framework to protect health; and the key differences between MP and nanoplast"
PMC12846036,Portable Multichannel Measurement System for Real-Time Microplastics Assessment Using Microwave Sensors,"André Barrancos, Diogo Rosinha, Jorge Assis, Luís S. Rosado",10.3390/s26020669,2026-01-19,2026,"This paper presents a multichannel electronics measurement system that uses microwave sensors to perform real-time microplastics assessment in aqueous environments. The system is capable of simultaneously reading up to four microwave sensors, enabling the use of multiple sensors that target microplastic particles with different sizes and properties. The multichannel capability allows the measurement of multiple MW sensors integrated with different microfluidic channel designs while targeting different MPs’ dimension ranges, although experimental validation in this work was limited to a single sensor. Each readout channel is implemented combining radio-technology-integrated circuits with a microprocessor that has advanced analog peripherals used for signal conditioning and acquisition. An ADF4351 wideband frequency synthesizer is used for excitation signal generation while an ADL5902 power detector converts the sensor output to a DC voltage. Baseline removal and amplification of the power detector output is realized with a MSP430FR2355 microprocessor which is also responsible for its acquisition at 40 kHz and digital decimation. Characterization results show the system’s capability to generate excitation signals between 700 MHz and 3.5 GHz with power levels around 0 dBm. Sensor output can be detected with a power between −50 dBm and −5 dBm and a 230 Hz bandwidth. A compact form factor of 15 cm × 10 cm × 3 cm was realized together with a low power consumption of 6.6 W. Validation was realized with a previously developed microwave sensor, demonstrating the detection of polyethylene spheres with 400 μm diameters animated in 10 mL/min flux within the microfluidics device."
PMC12846062,Associations of Fecal Microplastics with Oxidative Damage and Cardiopulmonary Function: Evidence from a Pilot Study,"Lili Xiao, Wenfeng Lu, Lan Qiu, Shuguang Wang, Jiayi Li, Jiayi Lai, Zhixuan Ji, Xiaoliang Li, Yun Zhou",10.3390/toxics14010075,2026-01-14,2026,"The ubiquity of microplastics (MPs) in the environment has raised significant concerns, yet their potential impacts on human health are not fully elucidated. This study aimed to quantify human exposure to MPs in feces and evaluate their associations with oxidative stress and cardiopulmonary function. A panel study was conducted in 16 male college students with three-round visits. Fecal MPs were quantified using infrared micro-spectroscopy, and health effects were assessed through urinary biomarkers of oxidative damage (MDA and 8-OHdG) and cardiopulmonary function tests. Associations between MP exposure and health outcomes were analyzed using linear mixed-effect models. We found that fecal MP amount across 48 samples from 16 participants showed high intra-individual variation and poor reproducibility (ICCs < 0.4). MPs in feces were predominantly identified as sheets and fragments in the 100–200 μm size range, with polyamide (PA), polyester, polyethylene (PE), and polypropylene as the primary polymer types. Significant relationships were observed between fecal MP amount and oxidative damage biomarkers. Each one-unit increase in MPs corresponded to a 0.827 increase in MDA (95% CI: 0.116, 1.54) and a 1.11 increase in 8-OHdG (95% CI: 0.235, 1.98), with fibrous shapes and specific polymers (PE and PA) being the primary drivers. No significant associations were found between MP exposure and lung function or blood pressure. These findings indicated that MP exposure was significantly linked to increased oxidative damage, highlighting a pressing public health concern regarding their subclinical biological effects."
PMC12847442,Long-term plastic mulching exacerbates the co-limitation of carbon and phosphorus in farmland by altering physicochemical properties and microbial interactions,"Tong Xu, Shuang Zheng, Xinqu Duo, Zhonghua Hou, Jinggui Wu",10.3389/fmicb.2025.1694370,2026-01-14,2026,"Prolonged plastic film mulching causes plastic residue accumulation and microplastic (MP) formation, compromising soil structure and causing contamination. This study examined mulching duration effects (0, 5, 10, 15 years) on soil MPs, physicochemical properties, microbial communities, and nutrient limitations at 0–20 cm and 20–40 cm depths in maize soils of western Jilin, China. Mulching duration significantly increased MP abundance. Film-like MPs dominated, progressively fragmenting into smaller sizes over time. Long-term mulching enhanced soil moisture and EC (Electrical Conductivity) but decreased SOC (Soil Organic Carbon) and TN (Total Nitrogen), while increasing TP (Total Phosphorus) and AP (Available phosphorus). Microbial responses diverged: bacterial diversity and network complexity rose with enhanced cooperation, whereas fungal networks showed intensified competition. Extracellular enzyme stoichiometry indicated aggravated microbial co-limitation by C (Carbon) and P (Phosphorus), driven by MP-induced SOC depletion and altered P dynamics. SEM (Structural Equation Modeling) revealed that plastic mulching directly altered soil physicochemical properties through MPs accumulation, while indirectly regulating microbial community composition, ultimately exacerbating C-P co-limitation in microbial metabolism. The study highlights soil health risks from long-term mulching and highlights the necessity to seek alternatives such as biodegradable films to mitigate soil health risks associated with long-term plastic mulching."
PMC12851477,Considering ecological traits of fishes to understand microplastic ingestion across Pacific coastal fisheries,"Jasha Dehm *, Kelly Thomas Brown, Eseta Drova, Rufino Varea, Joycinette Vosumbe Botleng, Siutiti Fe’ao, Lavata Nivaga, Laura Williams, Brian L. Stockwell, Salanieta Kitolelei, Cherie Morris, Nanise Kuridrani, June Brian Molitaviti, Vailala Matoto, Lotokufaki Paka Kaitua, Semese Alefaio, Hudson Feremaito, Krishna Kumar Kotra, Amanda Kirsty Ford",10.1371/journal.pone.0339852,2026-01-28,2026,"Coastal fisheries are essential to Pacific Island communities, providing vital nutrition, livelihoods, and cultural value, yet microplastic (MP) contamination poses a growing threat to both ecosystem and human health. This study presents a regional assessment of microplastic contamination in coastal fish across four Pacific Island Countries and Territories (Fiji, Tonga, Tuvalu, and Vanuatu), based on the compilation of four methodologically standardized datasets, enabling us to evaluate whether regional patterns of contamination are linked to the ecological traits of fish. A total of 878 fish from 138 species were analysed to reveal widespread ingestion (32.7% prevalence; 0.76 ± 0.05 MPs/individual), with Fiji exhibiting the highest contamination (74.5% frequency). Reef-associated invertivores such as  Lethrinus harak  showed elevated risks (80% contaminated in Fiji), driven by fiber-dominated particles (65–95%), while ecological traits (benthic feeding, reef habitats) increased exposure compared to nearshore pelagic species. Disparities emerged between nations, with Fiji’s sites exceeding global averages despite remoteness, whereas Vanuatu’s low fish contamination suggests restricted dispersal, successful waste management influences, or differential bioaccumulation pathways. Polypropylene, polyethylene, polyethylene terephthalate, and nylon were the dominant (~11–43%) polymer types across all countries. The findings highlight the essential need to incorporate the Pacific Island data into global pollution assessments to better represent tropical Pacific marine ecosystems. This work establishes a standardized baseline for microplastics in the Pacific coastal fish, providing a framework to guide future research on ecological impacts while highlighting the need to integrate these data into regional and global plastics negotiations. The study underscores the importance of expanding monitoring to underrepresented PICTs to better understand contamination drivers in island"
PMC12863054,Vinyl chloride oligomers: On the road to understand the potential toxicity of PVC nanoplastics,"Esperanza Quevedo, Emiliano Perez-Sanchez *, Alexis Caballero, Ana Martínez",10.1371/journal.pone.0339850,2026-01-12,2026,"On the road to understand the toxicity of nanoplastics, it is important to determine their capacity to interact with other molecules, as this is the first condition that must be met. In particular, polyvinyl chloride (PVC) is a versatile plastic widely used in construction. It can be degraded producing micro and nanoplastics, which can be formed when PVC pipes are cut during the manufacturing of products. PVC is considered to be one of the most toxic plastics, so it is important to analyze potential detrimental effects. This is the main aim of this research. On the basis of Density Functional Theory calculations, we investigated different vinyl chloride oligomers (as models of PVC nanoplastics). Degradation energies, electron donor acceptor capacities to analyze possible oxidation reactions, and interaction energies with different molecules were calculated. The vinyl chloride oligomers used in this investigation are saturated and monounsaturated. This is important since monounsaturated variant is dominant in experimental conditions. We found that none of the oligomers are good electron donors or acceptors. We also investigated different oligomers interacting with ciprofloxacin and •OOH. The interaction energies with ciprofloxacin and •OOH are negative or less than 13 kcal/mol, indicating weak interactions. This theoretical investigation indicates that vinyl chloride oligomers are not expected to be reactive or toxic, considering the electron transfer and the interaction energies with other molecules."
